{
  "schema_version": 2,
  "bundle_version": "2026-10-24.2",
  "prepared_on": "2026-10-24",
  "supersedes": "devir/sahit paketi 2026-10-24.1 (PR #4 dalı copilot/deus-ex-machina-user-layer @ 99dc8a37ef158ee42ee535f631f64e136fef202a); içeriği bu dala birleştirildi (merge 235b99620cd69090f1738aace6a1e173ae0c9d61).",
  "title": "Şahit CLI devri — deus_ex_machina kullanıcı katmanı",
  "prepared_state": "hazır/bekliyor — CLI devri kullanıcı tarafından henüz kabul edilmedi",
  "acceptance": {
    "state": "hazır/bekliyor",
    "accepted": false,
    "how": "Kullanıcı yerel Copilot CLI oturumunda paketi gözden geçirdikten sonra şu cümleyi yazar: 'Şahit devrini kabul ediyorum: <manifest.json bundle_sha256 ilk 12 hane>'. Cümle yoksa ya da hash bu paketin hash'iyle uyuşmuyorsa durum hazır/bekliyor kalır. Şahit kabulü kendisi yazmaz ve varsaymaz; kabul sonrası köprüye kayıt iş emriyle (Kopru_Izle.cmd Ekle) yazılır.",
    "scope_of_acceptance": "Yalnız bu paketin kapsamı ve 'eksik' ya da 'kısmi' işaretli maddelerin devamı. Kabul; yetki artırma, başka CLI çalıştırma, yazma, harici aktarım ya da model seçimi yetkisi vermez."
  },
  "source_snapshot_commit": "99dc8a37ef158ee42ee535f631f64e136fef202a",
  "main_snapshot_commit": "52c797e4c7e7b8029c6d1aad651ada8f57b7d4b8",
  "scope": {
    "completeness": "Bu paket cloud oturumunun taşınabilir devir kaynağını (kullanıcı istemleri, alıntılanan konuşma parçaları, doğrulanabilen PR durumları) ve CLI oturumunda gözlenen yerel doğrulamaları taşır. Tam ham sohbet dışa aktarımı değildir. Her alanın tamlık düzeyi completeness_matrix'te, eksik kaynaklar missing_sources'ta, kalan işler öncelik sırasıyla open_items'ta yazılıdır; tamamlanmış sayılan tek şey 'kesin' işaretli satırlardır.",
    "included": [
      "Problem bildirimindeki doğrudan kullanıcı talepleri ve görünür konuşma alıntıları",
      "Kullanıcı kararları, asistan önerileri ve denetlenmiş araç sonuçlarının ayrı sınıflandırması",
      "Okunan repository dosyaları, GitHub'dan doğrulanan PR durumları ve dallar",
      "CLI oturumunda gözlenen yerel doğrulamalar (local_verification) ve bilinen riskler (known_risks)"
    ],
    "excluded": [
      "Tam, ham sohbet export'u ve konuşmada görünmeyen mesajlar",
      "Gizli sistem/developer talimatları, araç şemaları, kimlik bilgileri ve özel yerel arşivler",
      "Makineye özgü mutlak yollar ve Home/cache içerikleri (yalnız betik değişken adları anılır)",
      "Sağlayıcının kapalı altyapısı, model ağırlıkları ve gizli çalışma anı talimatları"
    ],
    "truncation": "Kaynakta [..] veya başka kesinti işaretleri bulunan bölümler eksiksizmiş gibi tamamlanmamıştır.",
    "privacy_boundary": "Manifest yalnız repository-relative kaynak yollarını ve içerik hash'lerini yayımlar. Makineye özgü mutlak yollar, Home/cache konumları, anahtarlar, belirteçler, oturum dosyaları ve kimlik değerleri dışarı alınmaz. Hash ve tarama, gizli veri bulunmadığını garanti etmez."
  },
  "completeness_matrix": [
    {
      "id": "bridge-sources",
      "area": "Köprü yürütme kaynakları (README, AGENTS-kopru, kopru_yerel/izle/gonder, kopru_ekle/oku/yanitla/birlestir/bolum_ekle/ayna_uret, ayarlar*.json, istem-sablonu, workflow)",
      "level": "kesin",
      "basis": "Bu oturumda baştan sona okundu; yürütme akışı ve sınırları dosya+satırla işlendi.",
      "evidence": ["kopru_yerel.ps1:60-116 (SahitDevam)", "ayarlar-yerel.json:57-77 (Copilot (Şahit) çağrısı)", ".github/workflows/kopru.yml:9-14", "kopru_gonder.ps1:36"]
    },
    {
      "id": "cloud-pr4-content",
      "area": "Cloud PR #4 içeriği (devir paketi, görev kuyruğu, SahitDevam kapısı)",
      "level": "kesin",
      "basis": "Geçmişiyle birlikte güncel main üzerine birleştirildi; yalnız kopru.html ve ayna/kopru.html çakıştı ve main sürümü korundu.",
      "evidence": ["commit 235b99620cd69090f1738aace6a1e173ae0c9d61", "commit 99dc8a37ef158ee42ee535f631f64e136fef202a"]
    },
    {
      "id": "topic-separation",
      "area": "Steering / deus_ex_machina konu ayrımı (sayfa gezinimi, README, sözleşme)",
      "level": "kesin",
      "basis": "kopru.html'de Steering | deus_ex_machina gezinimi ve #deus_ex_machina bölümü main'de zaten vardı (bu dal sayfaya dokunmaz); README ve deus_ex_machina/SOZLESME.md ayrımı yazar.",
      "evidence": ["kopru.html#yonlendirme", "kopru.html#deus_ex_machina", "README.md:5-26", "deus_ex_machina/SOZLESME.md:12-22"]
    },
    {
      "id": "kopru-page-full",
      "area": "kopru.html'in 110 kaydının ve kayit/*.md bağlam günlüklerinin tamamı",
      "level": "kısmi",
      "basis": "Sayfa yapısı, iki konu bölümü, son 3 kayıt ve --kontrol çıktısı okundu; kayıtların tamamı ve kayit/*.md günlükleri okunmadı. Taban sonrası main'e k-0111 (Şaman, kapalı) eklendi; gövdesi okundu, durum bildirimidir ve iş atamaz.",
      "evidence": ["kopru_ekle.py kopru.html --kontrol: 110 kayıt, son k-0110", "kopru_yanitla.py kopru.html --bekleyenler Copilot: 0 kayıt"]
    },
    {
      "id": "saman-branch",
      "area": "Şaman dalı deus-ex-machina-2026-10-24 (README, KATMANLAR, DEVIR_DURUMU)",
      "level": "kısmi",
      "basis": "Dört belge (README, KATMANLAR, DEVIR_DURUMU, KAYNAK_DEVRI_20261024) df73d42 sürümüyle okundu; bu dala alınmadı (ayrı dal, PR yok). Şaman'ın k-0111 kaydı ve DEVIR_DURUMU.md, 99dc8a3'te SahitDevam ve kuyruk kodunun bulunduğunu, önceki 'yalnız belge' bulgusunun 69adfbc'ye ait olduğunu doğrular (kopru_yerel.ps1:60).",
      "evidence": ["commit df73d42c0ac63894617f92df7b97e5ec3cc97f78", "deus-ex-machina-2026-10-24:deus_ex_machina/KAYNAK_DEVRI_20261024.md", "köprü kaydı k-0111"]
    },
    {
      "id": "hacker-pr5",
      "area": "Hacker PR #5 (claude/hacker-devri-2026-10-24)",
      "level": "kısmi",
      "basis": "deus_ex_machina/HACKER.md ve devir/hacker/README.md okundu; devir/hacker/CLAUDE.md ve DEVIR.md okunmadı; bu dala alınmadı.",
      "evidence": ["commit 2a68b375a09475115d526fdb7d81d24b2c523ab1", "PR #5"]
    },
    {
      "id": "prior-prs",
      "area": "PR #1, #2, #3",
      "level": "kısmi",
      "basis": "Durum, taban ve dal GitHub'dan doğrulandı (üçü de açık taslak); içerikleri okunmadı ve birleştirilmedi.",
      "evidence": ["GitHub PR listesi, gözlem tarihi 2026-10-24"]
    },
    {
      "id": "local-copilot-cli",
      "area": "Yerel Copilot CLI sürümü ve help",
      "level": "kesin",
      "basis": "SahitDevam -Secenek Surum ve Yardim çalıştırıldı; sürüm 1.0.103, help 354 satır. Model adı seçilmedi.",
      "evidence": ["local_verification: copilot-version, copilot-help", "kopru_yerel.ps1:73-75"]
    },
    {
      "id": "local-model-choice",
      "area": "Geçerli model ve efor seçenekleri",
      "level": "eksik",
      "basis": "Help --model ve --reasoning-effort bayraklarını listeler; hesabın sunduğu model listesi doğrulanmadı. Seçim kullanıcıya aittir.",
      "evidence": ["local_verification: copilot-help"]
    },
    {
      "id": "local-paths",
      "area": "Yerel yol bağımlılıkları (kopru_yerel.ps1:32-45 değişkenleri)",
      "level": "kısmi",
      "basis": "Varlık Test-Path ile doğrulandı; yürütülebilir dosyaların hash'i, Hacker VM içindeki claude ve Codex çağrıları doğrulanmadı.",
      "evidence": ["local_verification: local-paths", "kopru_yerel.ps1:32-45"]
    },
    {
      "id": "interactive-launch",
      "area": "Etkileşimli başlatma (SahitDevam -Secenek Baslat) ve WinPE davranışı",
      "level": "eksik",
      "basis": "Etkileşimli oturum bu denetimde açılmadı; sahte yürütülebilirle başlatıcı testi vardır ama gerçek ikili ve WinPE ortam geri yüklemesi denenmedi.",
      "evidence": ["tests/test_sahit_launcher.ps1", "kopru_yerel.ps1:101-114"]
    },
    {
      "id": "user-acceptance",
      "area": "Kullanıcı kabulü",
      "level": "eksik",
      "basis": "Tasarım gereği bekliyor: kabul yalnız kullanıcının açık beyanıyla oluşur; otomatik varsayılmaz.",
      "evidence": ["acceptance.state: hazır/bekliyor"]
    },
    {
      "id": "first-real-cycle",
      "area": "İlk gerçek deus_ex_machina çevrimi (Haluk'un somut işi bir CLI'a ulaşır, kaynaklı gerçek yanıtla döner, kesilip sürdürülür)",
      "level": "eksik",
      "basis": "Yapılmadı; Şaman dalı bunu kabul ölçütü olarak koyar.",
      "evidence": ["deus-ex-machina-2026-10-24:deus_ex_machina/KATMANLAR.md (İlk gerçek çevrimin kabulü)"]
    },
    {
      "id": "provider-internals",
      "area": "Sağlayıcının kapalı katmanları",
      "level": "eksik",
      "basis": "Erişilemez; bypass önerilmez ve denenmedi.",
      "evidence": ["access_map: Hosted provider internals"]
    }
  ],
  "missing_sources": [
    { "id": "raw-chat-export", "source": "Cloud oturumunun tam ham sohbet export'u ve masaüstü arşivleri", "state": "erişilemez", "reason": "Erişilebilir görev bağlamında ve depoda yok; özetlerden yeniden kurulmaz.", "who_can_supply": "Kullanıcı" },
    { "id": "previous-task-urls", "source": "Üç önceki cloud task adresi (aşağıda kısaltılmış)", "state": "doğrulanamadı", "reason": "Cloud paketinde 404 döndüğü kayıtlı; bu oturumda GitHub görev API'si yok; tamamlanma kanıtı sayılmaz.", "who_can_supply": "Kullanıcı (tam adresler PR #4 geçmişinde)" },
    { "id": "pr123-contents", "source": "PR #1, #2, #3 içerikleri", "state": "eksik", "reason": "Yalnız durumları doğrulandı.", "who_can_supply": "Şahit (kullanıcı isterse) ve kullanıcı incelemesi" },
    { "id": "hacker-docs", "source": "devir/hacker/CLAUDE.md ve DEVIR.md (PR #5)", "state": "eksik", "reason": "Okunmadı.", "who_can_supply": "Şahit (kullanıcı isterse)" },
    { "id": "bridge-records", "source": "kopru.html'in 110 kaydı ve kayit/*.md günlükleri", "state": "eksik", "reason": "Yalnız yapı, iki bölüm ve son kayıtlar okundu.", "who_can_supply": "Şahit (kullanıcı isterse)" },
    { "id": "vm-codex-runtime", "source": "Hacker VM içindeki claude ve Codex çalıştırılabilirliği", "state": "doğrulanamadı", "reason": "Yalnız VM portunun açık olduğu gözlendi; ssh/claude/codex çağrısı yapılmadı.", "who_can_supply": "Kullanıcı (Kopru_Izle.cmd Hazirlik)" },